{
  "name": "QA Team",
  "type": "organization",
  "version": "1.0.0",
  "description": "Quality assurance team with test automation, GitHub triage, and release coordination workflows. Perfect for teams managing software quality and release processes.",
  "author": "ClawMax Team",
  "tags": [
    "qa",
    "testing",
    "quality",
    "release"
  ],
  "agents": [
    {
      "id": "qa-engineer",
      "name": "QA Engineer",
      "role": "Quality Assurance Engineer",
      "tags": [
        "qa",
        "testing",
        "automation"
      ],
      "skills": [],
      "communities": [
        "QA Team"
      ],
      "groups": [
        "QA",
        "Release"
      ]
    },
    {
      "id": "github-triager",
      "name": "GitHub Triager",
      "role": "Issue & PR Triager",
      "tags": [
        "github",
        "triage",
        "issues"
      ],
      "skills": [],
      "communities": [
        "QA Team"
      ],
      "groups": [
        "Triage"
      ]
    },
    {
      "id": "release-coordinator",
      "name": "Release Coordinator",
      "role": "Release Manager",
      "tags": [
        "release",
        "deployment",
        "coordination"
      ],
      "skills": [],
      "communities": [
        "QA Team"
      ],
      "groups": [
        "Release"
      ]
    }
  ],
  "communities": [
    {
      "name": "QA Team",
      "description": "Quality assurance and release management",
      "tags": [
        "qa",
        "testing",
        "release"
      ],
      "channels": [
        "whatsapp"
      ]
    }
  ],
  "groups": [
    {
      "name": "QA",
      "description": "Test automation and quality verification",
      "tags": [
        "qa",
        "testing"
      ],
      "community": "QA Team",
      "channels": [
        "whatsapp"
      ]
    },
    {
      "name": "Triage",
      "description": "GitHub issue and PR triage",
      "tags": [
        "github",
        "issues"
      ],
      "community": "QA Team",
      "channels": [
        "whatsapp"
      ]
    },
    {
      "name": "Release",
      "description": "Release coordination and deployment",
      "tags": [
        "release",
        "deployment"
      ],
      "community": "QA Team",
      "channels": [
        "whatsapp"
      ]
    }
  ],
  "workflows": [
    {
      "id": "pr-review",
      "name": "PR Review",
      "description": "Automated code review reminders",
      "schedule": "0 10,15 * * 1-5",
      "enabled": false,
      "executionMode": "automated",
      "targeting": {
        "communities": [],
        "groups": [
          "Triage"
        ],
        "tags": [],
        "agents": []
      },
      "content": "# PR Review Reminder\n\nCheck for open pull requests that need review:\n\n1. **Review pending PRs**: Prioritize by age and labels\n2. **Check for blockers**: Flag PRs marked as urgent\n3. **Assign reviewers**: Tag appropriate team members\n4. **Follow up**: Comment on stale PRs (>3 days)\n\nProvide summary of PR status and any urgent items."
    },
    {
      "id": "issue-triage",
      "name": "Issue Triage",
      "description": "Daily issue classification",
      "schedule": "0 9 * * 1-5",
      "enabled": false,
      "executionMode": "automated",
      "targeting": {
        "communities": [],
        "groups": [
          "Triage"
        ],
        "tags": [],
        "agents": []
      },
      "content": "# Daily Issue Triage\n\nReview new and unassigned GitHub issues:\n\n1. **Classify issues**: Add labels (bug, feature, enhancement)\n2. **Set priority**: P0 (critical), P1 (high), P2 (medium), P3 (low)\n3. **Assign owner**: Tag relevant team member or team\n4. **Add context**: Request more information if needed\n5. **Close duplicates**: Link to existing issues\n\nProvide summary of new issues and priority items."
    },
    {
      "id": "ci-cd-monitor",
      "name": "CI/CD Monitor",
      "description": "Build status tracking",
      "schedule": "0 */2 * * *",
      "enabled": false,
      "executionMode": "automated",
      "targeting": {
        "communities": [],
        "groups": [
          "QA"
        ],
        "tags": [],
        "agents": []
      },
      "content": "# CI/CD Status Check\n\nMonitor continuous integration and deployment pipelines:\n\n1. **Check build status**: Are all tests passing?\n2. **Deployment health**: Recent deployments successful?\n3. **Flaky tests**: Any tests failing intermittently?\n4. **Performance**: Build times within acceptable range?\n5. **Alerts**: Any system alerts or warnings?\n\nProvide status summary and flag any issues requiring attention."
    },
    {
      "id": "status-report-pm",
      "name": "Status Report to PM",
      "description": "Weekly progress summary",
      "schedule": "0 16 * * 5",
      "enabled": false,
      "executionMode": "managed",
      "targeting": {
        "communities": [
          "QA Team"
        ],
        "groups": [],
        "tags": [],
        "agents": []
      },
      "content": "# Weekly QA Status Report\n\nProvide your weekly update for the product manager:\n\n## This Week\n- **Testing completed**: Features tested and verified\n- **Bugs found**: Critical/high priority issues discovered\n- **Automation progress**: New tests added or updated\n\n## Metrics\n- Test coverage: Current percentage\n- Build stability: Pass/fail rate\n- Issue backlog: Open bugs and triage status\n\n## Next Week\n- **Testing plan**: Upcoming features to test\n- **Blockers**: Anything preventing progress?\n- **Improvements**: Process or tooling enhancements planned"
    }
  ]
}